paragraphs,link
"Among other things, throughout the live stream you will have the opportunity to communicate with us, get immediate (quick) answers to your questions, and most importantly, join one of the first AI communities in the world.",https://lablab.ai/stream/start-your-ai-career
Unlock your potential and join us for an exciting and rewarding journey into the world of AI!,https://lablab.ai/stream/start-your-ai-career
101 / ∞,https://lablab.ai/stream/start-your-ai-career
© 2023 New Native AB. All rights reserved.,https://lablab.ai/stream/start-your-ai-career
"Cohere provides through it's API unprecedented access to affordable, easy-to-deploy large language models capable of powering the next generation of game-changing AI native applications.",https://lablab.ai/event/generative-ai-hackathon
*You can get additional points if your project uses Cohere’s Generate endpoint.,https://lablab.ai/event/generative-ai-hackathon
"Additionally, all winning teams will receive exclusive holiday swag and have the chance to: Meet Cohere Founder for a virtual coffee & record a video of their demo that will be promoted on Cohere's channels!",https://lablab.ai/event/generative-ai-hackathon
Join lablab and Cohere during 48h to innovate and build the new generation of NLP powered applications. Find all the relevant details below.,https://lablab.ai/event/generative-ai-hackathon
"The hackathon starts on December 2nd and ends on December 4th. Over the weekend, you'll have the opportunity to learn from Cohere and lablab experts during workshops, keynotes, and mentoring sessions. The hackathon will take place on the lablab.ai platform.",https://lablab.ai/event/generative-ai-hackathon
"Previous experience in AI is not required but welcomed. While many participants are industry experts, we also welcome people with other types of domain knowledge that want to understand & explore how AI can be used in their fields.",https://lablab.ai/event/generative-ai-hackathon
To get started with Cohere NLP API please signup using the following link: https://cohere.ai/signup. Your trial API key are free and has and can handle up to 100 calls per minute free of charge. You can find more information about the API here.,https://lablab.ai/event/generative-ai-hackathon
"The hackathon will take place online on lablab.ai platform and lablab.ai Discord Server. Please register for both in order to participate. To participate click the ""Enroll"" button at the bottom of the page and read our Hackathon Guidelines.",https://lablab.ai/event/generative-ai-hackathon
"To get prepared for the hackathon, we recommend you to start at our Cohere technology page where you can find all the relevant information about the API and how to use it plus cohere tutorials and cohere boilerplates.",https://lablab.ai/event/generative-ai-hackathon
"Sandbox is a collection of experimental, open-source GitHub repositories that make building applications and/or showcasing how such applications are built using large language models fast and easy with Cohere. Sandbox repositories aim to enable all developers, regardless of ML experience, to:",https://lablab.ai/event/generative-ai-hackathon
Learn about the winning projects from previous episodes of the Cohere hackathons.,https://lablab.ai/event/generative-ai-hackathon
Prompt engineering and image generation tool.,https://lablab.ai/event/generative-ai-hackathon
An application that improves the efficiency of chat-based support systems.,https://lablab.ai/event/generative-ai-hackathon
"A tool for finding and browsing books based on short prompts, keywords, or story plot.",https://lablab.ai/event/generative-ai-hackathon
Cohere's API is currently free-to-use for everyone. Sign up for Cohere and start integrating NLP into your builds now!,https://lablab.ai/event/generative-ai-hackathon
"We welcome domain experts from all industries, not just AI or tech. Successful AI solutions require a combination of technical expertise and domain knowledge. Coding experience is recommended.",https://lablab.ai/event/generative-ai-hackathon
"You are welcome to join as a team or solo, if solo. We encourage you to look for a team before the event. We recommend you to join the Deep Learning Labs Discord channel: https://discord.gg/gCuBwBB35k and posting in the #looking-for-team channel to get to know your potential future team members.",https://lablab.ai/event/generative-ai-hackathon
"It is recommended, that at least one team member has a Github account. You can create one for free if you don't already have one.",https://lablab.ai/event/generative-ai-hackathon
You can use other APIs but with Generate you will be able to get some additional points.,https://lablab.ai/event/generative-ai-hackathon
"Feel free to reach us on social media, or through our Discord channel.",https://lablab.ai/event/generative-ai-hackathon
"Baith al suroor بَیتُ الْسرور (house of happiness in Arabic) 🏡🤖 is deeptech solution the power of artificial intelligence to transform your space. With the Cohere language Command model, it can generate descriptions of your desired design, and the Stable Diffusion generative model creates relevant images and transitional videos to bring your vision to your thoughts.",https://lablab.ai/event/generative-ai-hackathon
"I-Rene Provides CBT for the lovely user using Cohere Conversant AI tool. The NFT is minted for free by the lovely user to track the CBT sessions and be proud of their healing process. It is a free, open-source, specific & effective mental health therapy needed by everyone, anywhere at anytime. The mental health AI chatbot will be developed as a standalone application that users can download and install on their mobile devices or access through a web-based platform. The chatbot will collect and use user feedback to improve its performance and effectiveness. This will involve monitoring user interactions and responses, and using machine learning algorithms to continuously adapt and improve the chatbot's responses and support. The mental health AI chatbot will use sentiment analysis to understand the emotional state of users and react accordingly. For example, if a user is feeling sad or anxious, the chatbot can provide appropriate support and resources to help the user manage their emotions and feelings. The mental health AI chatbot will use entity extraction to provide context-dependent answers and support, rather than just generic responses. This will involve analyzing the user's messages and extracting relevant entities and information, such as the user's goals, concerns, and challenges. The chatbot can then use this information to provide personalized and tailored support. The mental health AI chatbot will be integrated with a decentralized autonomous organization (DAO) and the Metaverse, which is a virtual shared space for communities and organizations. This will enable the chatbot to access and use decentralized resources and data to provide more accurate, relevant, and engaging support to users.",https://lablab.ai/event/generative-ai-hackathon
vidSummarizer helps you to analyze sentiment & summarize of your audio & video files into simple text within few seconds. It also increase accessibility for users who are deaf.,https://lablab.ai/event/generative-ai-hackathon
Submissions from the teams participating in the Generative AI Hackathon event and making it to the end 👊,https://lablab.ai/event/generative-ai-hackathon
"Baith al suroor بَیتُ الْسرور (house of happiness in Arabic) 🏡🤖 is deeptech solution the power of artificial intelligence to transform your space. With the Cohere language Command model, it can generate descriptions of your desired design, and the Stable Diffusion generative model creates relevant images and transitional videos to bring your vision to your thoughts.",https://lablab.ai/event/generative-ai-hackathon
"I-Rene Provides CBT for the lovely user using Cohere Conversant AI tool. The NFT is minted for free by the lovely user to track the CBT sessions and be proud of their healing process. It is a free, open-source, specific & effective mental health therapy needed by everyone, anywhere at anytime. The mental health AI chatbot will be developed as a standalone application that users can download and install on their mobile devices or access through a web-based platform. The chatbot will collect and use user feedback to improve its performance and effectiveness. This will involve monitoring user interactions and responses, and using machine learning algorithms to continuously adapt and improve the chatbot's responses and support. The mental health AI chatbot will use sentiment analysis to understand the emotional state of users and react accordingly. For example, if a user is feeling sad or anxious, the chatbot can provide appropriate support and resources to help the user manage their emotions and feelings. The mental health AI chatbot will use entity extraction to provide context-dependent answers and support, rather than just generic responses. This will involve analyzing the user's messages and extracting relevant entities and information, such as the user's goals, concerns, and challenges. The chatbot can then use this information to provide personalized and tailored support. The mental health AI chatbot will be integrated with a decentralized autonomous organization (DAO) and the Metaverse, which is a virtual shared space for communities and organizations. This will enable the chatbot to access and use decentralized resources and data to provide more accurate, relevant, and engaging support to users.",https://lablab.ai/event/generative-ai-hackathon
vidSummarizer helps you to analyze sentiment & summarize of your audio & video files into simple text within few seconds. It also increase accessibility for users who are deaf.,https://lablab.ai/event/generative-ai-hackathon
"The solution is based on helping the content writers to easily generate content for their materials. Presently, content creators have to deeply think to write their content which is very time consuming and full of mental stress. This service can tremendously make content creator’s job easy. They can purchase monthly subscription to use tool.",https://lablab.ai/event/generative-ai-hackathon
Osusume is a Text-Based Recommendation Engine Powered by Cohere. We are attempting to create a sentiment-based recommendation system using Cohere's Text Embedding and use Text Generation to Explain why it is recommended. We implement Osusume as a framework for people to use their data for more comprehensive implementation for Cohere to be the core processor.,https://lablab.ai/event/generative-ai-hackathon
"To get MongoDB queries (output) as a response to the UI. In other words, MongoDB Query is a way to get the data from the MongoDB database. MongoDB queries provide the simplicity in process of fetching data from the database, it’s similar to SQL queries in SQL Database language.",https://lablab.ai/event/generative-ai-hackathon
"Smarty quiets the noise around you so you can work peacefully to get things done. It is a personalized task planner that evaluates the importance and urgency of your tasks, then prioritizes and batches them rigorously so you can focus on accomplishing what matters the most.",https://lablab.ai/event/generative-ai-hackathon
Prompt Tune Generation is a prototype model which has ability to generate music using Cohere prompt by understanding the user input. Using Prompt Tune user can play with different set of Genre as input prompt to the model which will generate music notes followed by a short music clip tuned using custom virtual Keyboard which has single octave. This is one step closer diffusion based model where Generative AI plays a vital role in generating contents on its own.,https://lablab.ai/event/generative-ai-hackathon
"Zo:diac is an interactive web app that provides unique, personalized horoscopes on-demand to users. It prompts the user for their information, including their birth date, and then returns a horoscope specific to their astrological information. It then allows the user to specify a topic, which zo:diac will then return additional horoscope content for. This process can be repeated, allowing the user to delve deeper into their astrology by generating new content. Both the initial horoscope reading and followup topic-based horoscopes are created using co:here’s generate endpoint, by modifying the input prefix to get the appropriate output. The application is created using react, and hosted by cloudflare. It can be accessed either on a desktop or mobile browser. The app is available at: https://zodiac.tarinyoom.io/",https://lablab.ai/event/generative-ai-hackathon
"This application can convert any given text into a visualization. We use LLMs to convert the text into a structured format, and then we use existing visualization libraries to generate infographics from the structured data. Right now in the demo we have built this end to end workflow for Graphs and Timelines but potentially this same tech can be used to power any infographic generation from raw text.",https://lablab.ai/event/generative-ai-hackathon
"Baskful is a tool to ease mass asset liquidation. The tool is meant to document items that are to be sold on sites such as Amazon and Ebay. Target users include estate sales, moving companies, and company closings. AI is used to generate copy for the products.",https://lablab.ai/event/generative-ai-hackathon
"""Virtual AI Patient"" is a new way dedicated to medical students in order to help them practice on their virtual patient so that they can act more professional and much faster when they face a similar cases in the reality.",https://lablab.ai/event/generative-ai-hackathon
We first tried to push the dataset to the API and train the model through Python script but couldn't find any documentations on that. So trained on web platform and also provided dataset as prompts.,https://lablab.ai/event/generative-ai-hackathon
"Using Cohere's API, we developed a solution to building more dynamic lessons by making lesson content creation easier and more efficient. By creating a more sustainable workflow for teachers, we hope this idea helps to step away from repetitive tasks to maximize class time with unique learning experiences and engage in more meaningful social interactions in the class room. The spark for this project was focused to build a culture of collaboration amongst fellow teachers to design more cross-curricular activities as well as interdisciplinary / multidisciplinary lessons to go beyond the textbook material in order for students to be exposed to more real-world connections for deeper understanding. With the numerous benefits of collaboration amongst peers, working together can exponentially improve educational experiences for teachers similarly to the idea that teachers encourage for their students. This project holds great meaning for us as we are passionate learners ourselves and we believe working together truly produces amazing results. We hope you enjoy it!",https://lablab.ai/event/generative-ai-hackathon
"The system generates emotions from images, primarily intended for game NPCs so that they would react emotionally to the game environment. The sentiment analysis model is an LSTM-based Dense Neural Network that are fed Word2Vec embeddings. The model was trained using generated data from cohere.ai using the prompt: ""I felt <emotion> when I saw <img2text>"" System Flow: img2txt -> cohere.ai generator -> text2emote -> LSTM+DenseNN The images are passed to a CLIP Interrogator (BLIP + CLIP (ViT-32-B)) to generate text descriptions. Such text descriptions are elaborated by cohere.ai generator to generate emotional responses using the prompts: ""When I saw <img2txt output>, I felt emotions such as""",https://lablab.ai/event/generative-ai-hackathon
"Today the number of literature readers is declining worldwide, especially among younger generations, which is affecting overall education level very negatively. This is mostly due to increasing popularity of online social media and gaming activities. However, technological development shouldn't mean for important knowledge to fade away. It is important to digitalize books and cognitive literature and adapt it to modern norms. That why we created Virtual Story app, which is hybrid of books and video games, based on various literature and with help of refined audio-visual and gaming elements, it will make reading process educational like books and engaging, fun and interactive like video games.",https://lablab.ai/event/generative-ai-hackathon
Generates the Cover letter Based on prompt with the help of cohere playground API. Feather is AI based model that automatically generates magnificent coverletter within a minute based on prompts feather helps you create eloquent cover letter for your dream.,https://lablab.ai/event/generative-ai-hackathon
"A ChatGPT alternative based on Cohere’s LLM. In the future, intelligent assistants that are smarter than humans will be a part of everyone's lives. They will assist us in our work, help us have fun, and improve our lives overall. And this is already happening with OpenAI's ChatGPT, which received amazing feedback over the last few days. Some even call it a Google killer! However, we want the future of AI assistants to be open and not solely belong to one company. AGI.chat is an initiative to create an open platform for these intelligent assistants. Currently, only Cohere models are supported, but we plan to add customization, switching between different language models, and more. We see AGI.chat as WordPress for AI-powered assistants.",https://lablab.ai/event/generative-ai-hackathon
"This is a demonstration of using NLP to create voice-activated experiences for interacting with products using 3D technologies. It uses NLP to generate product descriptions and intent recognition to create actions from voice. It leverages Web Speech API for text-to-speech and ThreeJS for rendering 3D, currently works on Chrome.",https://lablab.ai/event/generative-ai-hackathon
"We created an application to ease the lives of team leaders, by creating a fast and effortless pipeline to propagate the needed information to their teams, other than storing trivial information in pills for a more concise backtracking experience. Starting with OpenAI Whisper, we generate a transcription of the meeting, then by crossing the work of Cohere Generate and Classify, we managed to extract the needed information, then we organize them into a comfortable format to make sure they are easily findable. We developed a platform designed that recaps full business meetings and provides concise summaries including all the relevant information, a list of tasks mentioned during the meeting and the questions asked, with the relative answers. We thought this information was the most useful for a team's member, so the leader can send them the information fast, in order to fill a lack of knowledge and consequent slowdowns in the team's productivity.",https://lablab.ai/event/generative-ai-hackathon
"Travel back in time and meet your oldest new friend - Mr. Darcy! Our project is a unique pen pal experience; customers subscribe to snail mail one letter every week. We scan and process the letter, using a combination of Google Cloud OCR and Cohere's LLM. This allows Cohere to generate a response in the style of Mr. Darcy, from Pride and Prejudice. To complete the 18th century feel, we send the result to HandWrytten, a robot handwriting service that mails cards with authentic-looking handwriting. Our users are able to experience the joys of a true 18th century friendship, as the Mr. Darcy bot evolves to match the customer's whims through a long history of conversation. Even in the digital age, sometimes we all need a brief return to the analog systems of the past.",https://lablab.ai/event/generative-ai-hackathon
"It’s an AI based chatbot, the customers will put their queries and the system will analyze and then provide the best possible answer according to the query.",https://lablab.ai/event/generative-ai-hackathon
DiscernAI is an innovative program for detecting disinformation campaigns across social media.,https://lablab.ai/event/generative-ai-hackathon
Generative AI.,https://lablab.ai/event/generative-ai-hackathon
We will be creating AI art using Midjourney AI. Enjoy creating!,https://lablab.ai/event/generative-ai-hackathon
"The Soggy Bottom Boys is a team of AI researchers who are passionate about making machines that can think and act like humans. They believe that artificial intelligence is the key to unlocking the mysteries of the universe, and they are dedicated to making it a reality.",https://lablab.ai/event/generative-ai-hackathon
"Bringing AI for good, empowering people to bridge gap divisio.",https://lablab.ai/event/generative-ai-hackathon
Group of developers trying to create something great.,https://lablab.ai/event/generative-ai-hackathon
Virtual Story is a hybrid app of books and video games to make reading process more engaging and interactive.,https://lablab.ai/event/generative-ai-hackathon
A first-timer team that is looking forward to improve their skills while solving multiple problems.,https://lablab.ai/event/generative-ai-hackathon
Leveraging Cohere to help users improve their resumes.,https://lablab.ai/event/generative-ai-hackathon
Creating state of the art private generative models.,https://lablab.ai/event/generative-ai-hackathon
"Baith ﺑَﻴﺖ 🏡💡🤖, Transform your space with the power of artificial intelligence. Baith AI ﺑَﻴﺖ is an app that uses the power of artificial intelligence to transform your space. With the Cohere language Command model, it can generate descriptions of your desired design, and the Stable Diffusion algorithm creates relevant images to bring your vision to life in HD. Give Baith a try and see how it can elevate your interior design.",https://lablab.ai/event/generative-ai-hackathon
RetroV will detect a cyber attack and take counter measures instantly. RetroV AI will also constantly pentest systems security to detect any security flaw or bugs and notify/fix the problem.,https://lablab.ai/event/generative-ai-hackathon
AI explorers.....,https://lablab.ai/event/generative-ai-hackathon
LotAI is an Artificial Intelligence based software program that prevents spreading of fake information on the internet.,https://lablab.ai/event/generative-ai-hackathon
"""Virtual AI Patient"" is a new way dedicated to medical students in order to help them practice on their virtual patient so that they can act more professional and much faster when they face a similar cases in the reality.",https://lablab.ai/event/generative-ai-hackathon
Where coding never stops...,https://lablab.ai/event/generative-ai-hackathon
Health and Wellness revolutionized.,https://lablab.ai/event/generative-ai-hackathon
A team of 2 with mind blowing ideas collaborating together to achieve greater heights.,https://lablab.ai/event/generative-ai-hackathon
Intelligence at its peak!!....,https://lablab.ai/event/generative-ai-hackathon
"TWIS means ""That's What I Said"".",https://lablab.ai/event/generative-ai-hackathon
Intelligent edtech platform which leverages artificial intelligence and machine learning/deep learning.,https://lablab.ai/event/generative-ai-hackathon
Just some Pisters working on generative conversational agents.,https://lablab.ai/event/generative-ai-hackathon
"Hello, we are Error404!",https://lablab.ai/event/generative-ai-hackathon
"Hi , This is team Interrupters.",https://lablab.ai/event/generative-ai-hackathon
Traditionally non-traditional team passionate about education.,https://lablab.ai/event/generative-ai-hackathon
One man army!,https://lablab.ai/event/generative-ai-hackathon
Generative eXplainable AI (XPlain),https://lablab.ai/event/generative-ai-hackathon
"Utilize NLP to transform model explainability outputs (e.g. from SHAP) into readable actionable explanations. This could possibly include external information about the model, the code, its performance, and training data,",https://lablab.ai/event/generative-ai-hackathon
From pain to glory!,https://lablab.ai/event/generative-ai-hackathon
The roads to turn things into beings.,https://lablab.ai/event/generative-ai-hackathon
"This team name is after Muḥammad ibn Mūsā al-Khwārizmī who produced vastly influential works in mathematics, astronomy, and geography.",https://lablab.ai/event/generative-ai-hackathon
An app that generates gifts based on personality type.,https://lablab.ai/event/generative-ai-hackathon
A web app that uses cohere NLP API for automating tedious tasks.,https://lablab.ai/event/generative-ai-hackathon
Ukrainian software engineer and a conversational AI specialist vs. the world.,https://lablab.ai/event/generative-ai-hackathon
We're here to push the limits!,https://lablab.ai/event/generative-ai-hackathon
"Linking A.I. with mental health therapies to provide free, affordable and effective mental health treatments for all. Again. This path is challenging, but it's worth taking to save the lives of those who see no hope and yet deserve all the love.",https://lablab.ai/event/generative-ai-hackathon
"I am the dark, I am the night!",https://lablab.ai/event/generative-ai-hackathon
Create something smart and interesting to autocomplete our lives.,https://lablab.ai/event/generative-ai-hackathon
LA/Seattle duo joining for fun~,https://lablab.ai/event/generative-ai-hackathon
0 / ∞,https://lablab.ai/event/generative-ai-hackathon
© 2023 New Native AB. All rights reserved.,https://lablab.ai/event/generative-ai-hackathon
Are you interested in organizing an AI hackathon? Great! We would love to have you as our sponsor.,https://lablab.ai/cooperation
